{
  "topic": "Claude Code makes videos with code (for free)",
  "spine": "A",
  "style": "S11",
  "hook": {
    "main": "Claude Code now makes videos.",
    "kicker": "(for free) · No video editor. No AI video credits. Runs on your Claude plan.",
    "visual_promise": "The CLAUDE-wordmark frame from the low-effort, one-prompt reel (video 5:05) inside a video player",
    "formula": "F10",
    "score": {
      "R1": 2,
      "R2": 2,
      "R3": 2,
      "R4": 1,
      "R5": 2,
      "R6": 2,
      "total": 11,
      "note": "Judge panel picked this hook 2 of 3 (outcome draft); '(for free)' is bounded by the kicker. R4=1: evergreen, no news peg."
    }
  },
  "alt_hooks": [
    {
      "main": "My Claude Code makes videos now",
      "kicker": "(for free) · here's the exact prompt",
      "formula": "F10",
      "note": "all three writers produced it independently; best A/B backup"
    },
    {
      "main": "Claude can't watch videos. It makes yours.",
      "kicker": "(one prompt · $0 in new tools)",
      "formula": "F11",
      "note": "accuracy judge's pick; best B-test"
    },
    {
      "main": "Claude Code + 2 free tools = your own explainer video",
      "kicker": "$0 in video software",
      "formula": "F12",
      "note": "enemy draft"
    }
  ],
  "keyword": "ANIMATE",
  "deliverable": {
    "name": "animate skill (github.com/cth9191/animate)",
    "exists": true,
    "path_or_url": "https://github.com/cth9191/animate"
  },
  "intent": {
    "what": "Claude Code, Claude's coding app, makes real MP4 videos by writing code that draws every frame; it is not an AI video generator.",
    "why": "You can make your own animated videos without paying for any video tools.",
    "first_step": "Comment ANIMATE to get the free animate skill, paste its link into Claude Code to install it, then ask it for a video."
  },
  "glossary": [
    {
      "term": "Claude Code",
      "defined_on": 1,
      "definition": "Claude's coding app"
    },
    {
      "term": "MP4",
      "defined_on": 2,
      "definition": "a normal video file"
    },
    {
      "term": "JavaScript",
      "defined_on": 4,
      "definition": "the code language web pages run on"
    },
    {
      "term": "frame",
      "defined_on": 4,
      "definition": "one picture; 60 make one second"
    },
    {
      "term": "Playwright",
      "defined_on": 4,
      "definition": "a hidden copy of Chrome that draws each frame"
    },
    {
      "term": "FFmpeg",
      "defined_on": 4,
      "definition": "a free tool that stitches frames into an MP4"
    },
    {
      "term": "contact sheet",
      "defined_on": 5,
      "definition": "one image with many frames in a grid"
    },
    {
      "term": "storyboard",
      "defined_on": 6,
      "definition": "one page with a key frame for every scene"
    },
    {
      "term": "canvas",
      "defined_on": 7,
      "definition": "a drawing area on a web page"
    },
    {
      "term": "skill",
      "defined_on": 9,
      "definition": "a saved set of steps Claude Code follows"
    }
  ],
  "slides": [
    {
      "n": 1,
      "role": "cover",
      "lesson": "Claude Code can make real videos, and it costs nothing extra.",
      "headline": "Claude Code now makes videos.",
      "strings": [
        {
          "text": "CHASE AI",
          "place": "chrome",
          "count": 1
        },
        {
          "text": "01 / 10",
          "place": "counter",
          "count": 1
        },
        {
          "text": "Claude Code now makes videos.",
          "place": "headline",
          "count": 1
        },
        {
          "text": "(for free)",
          "place": "headline-2",
          "count": 1
        },
        {
          "text": "No video editor. No AI video credits. Runs on your Claude plan.",
          "place": "kicker",
          "count": 1
        },
        {
          "text": "made by Claude Code, Claude's coding app · one prompt",
          "place": "player-bar",
          "count": 1
        }
      ],
      "evidence": {
        "kind": "prove",
        "describe": "A still from a finished video Claude Code made from one short prompt: the word CLAUDE in white letters orbiting an orange ring on black, inside a video player with a play button",
        "source": "video 5:05 (Level 1, the low-effort run, ~20 min; reel spans 4:55-5:05), hi-res frame pulled from the source video (not included); webcam bubble to scrub. F2, F8"
      }
    },
    {
      "n": 2,
      "role": "what",
      "lesson": "It is not AI video; Claude writes code that draws every frame.",
      "headline": "Not AI video. Code that draws.",
      "strings": [
        {
          "text": "CHASE AI",
          "place": "chrome",
          "count": 1
        },
        {
          "text": "02 / 10",
          "place": "counter",
          "count": 1
        },
        {
          "text": "WHAT IT IS",
          "place": "eyebrow",
          "count": 1
        },
        {
          "text": "Not AI video. Code that draws.",
          "place": "headline",
          "count": 1
        },
        {
          "text": "AI video tools guess every pixel. Claude Code writes code that draws each picture, then joins the pictures into an MP4 video.",
          "place": "body",
          "count": 1
        },
        {
          "text": "drawn by hand",
          "place": "capture (struck through)",
          "count": 1
        },
        {
          "text": "AI video",
          "place": "capture (struck through)",
          "count": 1
        },
        {
          "text": "You describe it → Claude codes every picture → checks them → you get an MP4",
          "place": "strip",
          "count": 1
        }
      ],
      "evidence": {
        "kind": "prove",
        "describe": "A frame from a video Claude Code made: a circle-and-wave animation, with the words 'drawn by hand' and 'AI video' crossed out underneath",
        "source": "video 1:08 (one-shot explainer beat 'not drawn, not AI video'), draft frame from the source video (not included); F2, F4"
      }
    },
    {
      "n": 3,
      "role": "why",
      "lesson": "The only cost is the Claude plan you already have.",
      "headline": "The only bill: your Claude plan",
      "strings": [
        {
          "text": "CHASE AI",
          "place": "chrome",
          "count": 1
        },
        {
          "text": "03 / 10",
          "place": "counter",
          "count": 1
        },
        {
          "text": "WHAT IT COSTS",
          "place": "eyebrow",
          "count": 1
        },
        {
          "text": "The only bill: your Claude plan",
          "place": "headline",
          "count": 1
        },
        {
          "text": "Video editing software | $0 · not needed",
          "place": "receipt",
          "count": 1
        },
        {
          "text": "AI video generator credits | $0 · not needed",
          "place": "receipt",
          "count": 1
        },
        {
          "text": "The 2 tools it runs on your computer | $0 · free and open source",
          "place": "receipt",
          "count": 1
        },
        {
          "text": "Voice-over | optional",
          "place": "receipt",
          "count": 1
        },
        {
          "text": "Your Claude plan | the one you already have",
          "place": "receipt",
          "count": 1
        },
        {
          "text": "Total extra: $0",
          "place": "receipt-total",
          "count": 1
        },
        {
          "text": "Free ≠ unlimited: videos count toward your Claude usage limits.",
          "place": "footnote",
          "count": 1
        }
      ],
      "evidence": {
        "kind": "prove",
        "describe": "A receipt: video software $0, AI video credits $0, the 2 tools $0, voice-over optional, your Claude plan, total extra $0",
        "source": "F3: video ~3:00 'I'm not paying for any outside tools to do this'; outro 'We just pay for it with usage'; Playwright Apache-2.0, FFmpeg LGPL/GPL"
      }
    },
    {
      "n": 4,
      "role": "model",
      "lesson": "A video is 60 pictures a second; code draws them and two free tools turn them into an MP4.",
      "headline": "A video is 60 pictures a second",
      "strings": [
        {
          "text": "CHASE AI",
          "place": "chrome",
          "count": 1
        },
        {
          "text": "04 / 10",
          "place": "counter",
          "count": 1
        },
        {
          "text": "HOW IT WORKS",
          "place": "eyebrow",
          "count": 1
        },
        {
          "text": "A video is 60 pictures a second",
          "place": "headline",
          "count": 1
        },
        {
          "text": "1 · JavaScript: the code language web pages run on",
          "place": "part-label",
          "count": 1
        },
        {
          "text": "2 · Playwright: a hidden copy of Chrome that draws each frame",
          "place": "part-label",
          "count": 1
        },
        {
          "text": "3 · Frame: one picture. 60 make one second.",
          "place": "part-label",
          "count": 1
        },
        {
          "text": "4 · FFmpeg: a free tool that stitches frames into an MP4",
          "place": "part-label",
          "count": 1
        },
        {
          "text": "Playwright and FFmpeg are both free and open source.",
          "place": "caption",
          "count": 1
        }
      ],
      "evidence": {
        "kind": "explain",
        "describe": "Diagram from the explainer Claude made about itself: a box of code, a browser drawing a circle-and-wave picture, a stack of frames, FFmpeg, a video play button; numbered 1-4 to match the labels",
        "source": "video 1:32 (clean pipeline beat of the one-shot explainer), draft frame from the source video (not included); F5"
      }
    },
    {
      "n": 5,
      "role": "how",
      "lesson": "Claude checks a contact sheet of its own frames, fixes the code and re-renders.",